{
  "schemaVersion": 2,
  "target": "darwin-arm64",
  "authority": {
    "runnerLabel": "focused-darwin-arm64",
    "xcodeVersion": "Xcode 26.1.1\nBuild version 17B100",
    "sdkVersion": "26.1",
    "cpuModel": "Apple M1 Max",
    "logicalCpuCount": 10,
    "memoryBytes": 68719476736,
    "minimumFreeDiskBytes": 8589934592,
    "observedFreeDiskBytes": 306939994112
  },
  "tools": {
    "node": {
      "path": "/Users/normy/.hermes/node/bin/node",
      "sha256": "2e3f1286a7eb3736346ed1803e458a0ff909e2b2d5bc746144dcb76970e9b99d"
    },
    "cmake": {
      "path": "/private/tmp/autobyteus-voice-api-e2e-r22-20260810-v2/tools/cmake-4.2.0-macos-universal/CMake.app/Contents/bin/cmake",
      "sha256": "d03ae0d5208459e5339a1ee62c0d0698132f9488e9c47216b0f2b8141f970fbb"
    },
    "cCompiler": {
      "path": "/Applications/Xcode.app/Contents/Developer/Toolchains/XcodeDefault.xctoolchain/usr/bin/clang",
      "sha256": "d5ba7be6de1bac17bfd018e1591711e69cb94d199a0ba763427c8b2d67c50697"
    },
    "cxxCompiler": {
      "invocationPath": "/Applications/Xcode.app/Contents/Developer/Toolchains/XcodeDefault.xctoolchain/usr/bin/clang++",
      "linkTarget": "clang",
      "targetPath": "/Applications/Xcode.app/Contents/Developer/Toolchains/XcodeDefault.xctoolchain/usr/bin/clang",
      "targetSha256": "d5ba7be6de1bac17bfd018e1591711e69cb94d199a0ba763427c8b2d67c50697"
    },
    "archiver": {
      "path": "/Applications/Xcode.app/Contents/Developer/Toolchains/XcodeDefault.xctoolchain/usr/bin/ar",
      "sha256": "03925f16d09748c4406abd797d77979fa84e14001f660672a3b23105445e6a6e"
    },
    "ranlib": {
      "invocationPath": "/Applications/Xcode.app/Contents/Developer/Toolchains/XcodeDefault.xctoolchain/usr/bin/ranlib",
      "linkTarget": "libtool",
      "targetPath": "/Applications/Xcode.app/Contents/Developer/Toolchains/XcodeDefault.xctoolchain/usr/bin/libtool",
      "targetSha256": "d12f4f90046f0e15261e578f5288b40f5750f3f5f606370e6252fc74099d94e6"
    },
    "linker": {
      "path": "/Applications/Xcode.app/Contents/Developer/Toolchains/XcodeDefault.xctoolchain/usr/bin/ld",
      "sha256": "2f8ee9a6fb55f61d9a4ea7abd9d4bfd5e1e0017bdd5248cd45839018c5fc4ca1"
    },
    "libtool": {
      "path": "/Applications/Xcode.app/Contents/Developer/Toolchains/XcodeDefault.xctoolchain/usr/bin/libtool",
      "sha256": "d12f4f90046f0e15261e578f5288b40f5750f3f5f606370e6252fc74099d94e6"
    },
    "make": {
      "path": "/usr/bin/make",
      "sha256": "179301dcb41ea78accc3fa0048a7e6f6710d891945a751a34addd622020c1818"
    },
    "sed": {
      "path": "/usr/bin/sed",
      "sha256": "abd2eb945442a8ab1d210e58edb153f34870ee6d7c359f0f6d8385b1f7fc50fc"
    },
    "shell": {
      "path": "/bin/sh",
      "sha256": "ad5c194b05f83bc5e793c1cd67b148a4b680467b5a5730ab1a31fe4e6460ee9f"
    },
    "tar": {
      "path": "/usr/bin/bsdtar",
      "sha256": "9ab7f0793033dc9dc4809d83d695118801bd687cbacda59a0cbbf151ba25dc2b"
    },
    "sdk": {
      "path": "/Applications/Xcode.app/Contents/Developer/Platforms/MacOSX.platform/Developer/SDKs/MacOSX26.1.sdk",
      "version": "26.1",
      "settingsSha256": "5129596158c8ed65953feb9f40eac98e74c8e4fcf5acb5629a0642f3f65663ff"
    }
  },
  "configuration": {
    "generator": "Unix Makefiles",
    "buildType": "Release",
    "parallelism": 1,
    "flagPolicy": "empty-external-native-flags-v1"
  },
  "environment": {
    "pathPolicy": "isolated-verified-tools-v1",
    "locale": "C",
    "clearedOverrides": [
      "AR",
      "ARCHFLAGS",
      "AS",
      "ASMFLAGS",
      "CC",
      "CCC_OVERRIDE_OPTIONS",
      "CFLAGS",
      "CMAKE_BUILD_PARALLEL_LEVEL",
      "CMAKE_CXX_COMPILER_LAUNCHER",
      "CMAKE_C_COMPILER_LAUNCHER",
      "CMAKE_GENERATOR",
      "CMAKE_GENERATOR_INSTANCE",
      "CMAKE_GENERATOR_PLATFORM",
      "CMAKE_GENERATOR_TOOLSET",
      "CMAKE_MAKE_PROGRAM",
      "CMAKE_PREFIX_PATH",
      "CMAKE_TOOLCHAIN_FILE",
      "CPATH",
      "CPLUS_INCLUDE_PATH",
      "CPPFLAGS",
      "CXX",
      "CXXFLAGS",
      "C_INCLUDE_PATH",
      "DEVELOPER_DIR",
      "DYLD_LIBRARY_PATH",
      "GCC_EXEC_PREFIX",
      "INCLUDE",
      "LD",
      "LDFLAGS",
      "LD_LIBRARY_PATH",
      "LIBRARY_PATH",
      "MACOSX_DEPLOYMENT_TARGET",
      "OBJCPLUS_INCLUDE_PATH",
      "OBJC_INCLUDE_PATH",
      "SDKROOT",
      "TOOLCHAINS"
    ]
  }
}
